root@LAMP-Stack:~# tcpdump -r 0001.pcap
reading from file 0001.pcap, link-type EN10MB (Ethernet)
14:12:20.802751 IP LAMP-Stack.ssh > 198.96.84.204.42798: Flags [P.], seq 1231550756:1231550800, ack 4051673816, win 501, options [nop,nop,TS val 2984678531 ecr 2096082371], length 44
14:12:20.802845 IP LAMP-Stack.ssh > 198.96.84.204.42798: Flags [P.], seq 44:152, ack 1, win 501, options [nop,nop,TS val 2984678531 ecr 2096082371], length 108
14:12:20.802900 IP LAMP-Stack.ssh > 198.96.84.204.42798: Flags [P.], seq 152:188, ack 1, win 501, options [nop,nop,TS val 2984678531 ecr 2096082371], length 36
14:12:20.805232 IP 198.96.84.204.42798 > LAMP-Stack.ssh: Flags [.], ack 44, win 812, options [nop,nop,TS val 2096082390 ecr 2984678531], length 0
14:12:20.805273 IP 198.96.84.204.42798 > LAMP-Stack.ssh: Flags [.], ack 152, win 812, options [nop,nop,TS val 2096082390 ecr 2984678531], length 0
14:12:20.805390 IP 198.96.84.204.42798 > LAMP-Stack.ssh: Flags [.], ack 188, win 812, options [nop,nop,TS val 2096082390 ecr 2984678531], length 0
14:12:21.829317 IP6 fe80::fc96:acff:fe23:620d > ip6-allrouters: ICMP6, router solicitation, length 16
14:12:44.200529 IP 78.152.161.93.43911 > LAMP-Stack.microsoft-ds: Flags [S], seq 163204284, win 8192, options [mss 1460,nop,wscale 2,nop,nop,sackOK], length 0
14:12:44.257673 IP 5.136.142.202.53320 > LAMP-Stack.microsoft-ds: Flags [S], seq 243516380, win 8192, options [mss 1452,nop,wscale 2,nop,nop,sackOK], length 0
