14:14:04.296520 IP 142.93.150.209.22 > 198.96.84.204.42798: Flags [P.], seq 3679596:3680432, ack 2233, win 501, options [nop,nop,TS val 2984782024 ecr 2096185881], length 836
14:14:04.296627 IP 142.93.150.209.22 > 198.96.84.204.42798: Flags [P.], seq 3680432:3680644, ack 2233, win 501, options [nop,nop,TS val 2984782024 ecr 2096185881], length 212
14:14:04.296732 IP 142.93.150.209.22 > 198.96.84.204.42798: Flags [P.], seq 3680644:3680856, ack 2233, win 501, options [nop,nop,TS val 2984782024 ecr 2096185881], length 212
14:14:04.296824 IP 142.93.150.209.22 > 198.96.84.204.42798: Flags [P.], seq 3680856:3681068, ack 2233, win 501, options [nop,nop,TS val 2984782024 ecr 2096185881], length 212
14:14:04.296918 IP 142.93.150.209.22 > 198.96.84.204.42798: Flags [P.], seq 3681068:3681280, ack 2233, win 501, options [nop,nop,TS val 2984782024 ecr 2096185881], length 212
14:14:04.297011 IP 142.93.150.209.22 > 198.96.84.204.42798: Flags [P.], seq 3681280:3681492, ack 2233, win 501, options [nop,nop,TS val 2984782024 ecr 2096185881], length 212
14:14:04.297108 IP 142.93.150.209.22 > 198.96.84.204.42798: Flags [P.], seq 3681492:3681704, ack 2233, win 501, options [nop,nop,TS val 2984782024 ecr 2096185881], length 212
14:14:04.297209 IP 142.93.150.209.22 > 198.96.84.204.42798: Flags [P.], seq 3681704:3681916, ack 2233, win 501, options [nop,nop,TS val 2984782025 ecr 2096185881], length 212
14:14:04.297306 IP 142.93.150.209.22 > 198.96.84.204.42798: Flags [P.], seq 3681916:3682128, ack 2233, win 501, options [nop,nop,TS val 2984782025 ecr 2096185881], length 212
14:14:04.297405 IP 142.93.150.209.22 > 198.96.84.204.42798: Flags [P.], seq 3682128:3682340, ack 2233, win 501, options [nop,nop,TS val 2984782025 ecr 2096185881], length 212
14:14:04.297504 IP 142.93.150.209.22 > 198.96.84.204.42798: Flags [P.], seq 3682340:3682552, ack 2233, win 501, options [nop,nop,TS val 2984782025 ecr 2096185881], length 212
14:14:04.297597 IP 142.93.150.209.22 > 198.96.84.204.42798: Flags [P.], seq 3682552:3682764, ack 2233, win 501, options [nop,nop,TS val 2984782025 ecr 2096185881], length 212
14:14:04.297691 IP 142.93.150.209.22 > 198.96.84.204.42798: Flags [P.], seq 3682764:3682976, ack 2233, win 501, options [nop,nop,TS val 2984782025 ecr 2096185881], length 212
14:14:04.297787 IP 142.93.150.209.22 > 198.96.84.204.42798: Flags [P.], seq 3682976:3683188, ack 2233, win 501, options [nop,nop,TS val 2984782025 ecr 2096185881], length 212
14:14:04.297884 IP 142.93.150.209.22 > 198.96.84.204.42798: Flags [P.], seq 3683188:3683400, ack 2233, win 501, options [nop,nop,TS val 2984782025 ecr 2096185881], length 212
14:14:04.297978 IP 142.93.150.209.22 > 198.96.84.204.42798: Flags [P.], seq 3683400:3683612, ack 2233, win 501, options [nop,nop,TS val 2984782025 ecr 2096185881], length 212
14:14:04.298078 IP 142.93.150.209.22 > 198.96.84.204.42798: Flags [P.], seq 3683612:3683824, ack 2233, win 501, options [nop,nop,TS val 2984782025 ecr 2096185881], length 212
14:14:04.298175 IP 142.93.150.209.22 > 198.96.84.204.42798: Flags [P.], seq 3683824:3684036, ack 2233, win 501, options [nop,nop,TS val 2984782025 ecr 2096185881], length 212
14:14:04.298265 IP 142.93.150.209.22 > 198.96.84.204.42798: Flags [P.], seq 3684036:3684248, ack 2233, win 501, options [nop,nop,TS val 2984782026 ecr 2096185881], length 212
14:14:04.298383 IP 142.93.150.209.22 > 198.96.84.204.42798: Flags [P.], seq 3684248:3684460, ack 2233, win 501, options [nop,nop,TS val 2984782026 ecr 2096185881], length 212
14:14:04.298474 IP 142.93.150.209.22 > 198.96.84.204.42798: Flags [P.], seq 3684460:3684672, ack 2233, win 501, options [nop,nop,TS val 2984782026 ecr 2096185881], length 212
14:14:04.298570 IP 142.93.150.209.22 > 198.96.84.204.42798: Flags [P.], seq 3684672:3684884, ack 2233, win 501, options [nop,nop,TS val 2984782026 ecr 2096185881], length 212
14:14:04.298676 IP 142.93.150.209.22 > 198.96.84.204.42798: Flags [P.], seq 3684884:3685096, ack 2233, win 501, options [nop,nop,TS val 2984782026 ecr 2096185881], length 212
14:14:04.298782 IP 142.93.150.209.22 > 198.96.84.204.42798: Flags [P.], seq 3685096:3685308, ack 2233, win 501, options [nop,nop,TS val 2984782026 ecr 2096185881], length 212
14:14:04.298883 IP 142.93.150.209.22 > 198.96.84.204.42798: Flags [P.], seq 3685308:3685520, ack 2233, win 501, options [nop,nop,TS val 2984782026 ecr 2096185881], length 212
14:14:04.298976 IP 142.93.150.209.22 > 198.96.84.204.42798: Flags [P.], seq 3685520:3685732, ack 2233, win 501, options [nop,nop,TS val 2984782026 ecr 2096185881], length 212
14:14:04.299116 IP 142.93.150.209.22 > 198.96.84.204.42798: Flags [P.], seq 3685732:3685944, ack 2233, win 501, options [nop,nop,TS val 2984782026 ecr 2096185881], length 212
14:14:04.299213 IP 142.93.150.209.22 > 198.96.84.204.42798: Flags [P.], seq 3685944:3686156, ack 2233, win 501, options [nop,nop,TS val 2984782027 ecr 2096185881], length 212
14:14:04.299302 IP 142.93.150.209.22 > 198.96.84.204.42798: Flags [P.], seq 3686156:3686368, ack 2233, win 501, options [nop,nop,TS val 2984782027 ecr 2096185881], length 212
14:14:04.299398 IP 142.93.150.209.22 > 198.96.84.204.42798: Flags [P.], seq 3686368:3686580, ack 2233, win 501, options [nop,nop,TS val 2984782027 ecr 2096185881], length 212
14:14:04.299485 IP 142.93.150.209.22 > 198.96.84.204.42798: Flags [P.], seq 3686580:3686792, ack 2233, win 501, options [nop,nop,TS val 2984782027 ecr 2096185881], length 212
14:14:04.299576 IP 142.93.150.209.22 > 198.96.84.204.42798: Flags [P.], seq 3686792:3687004, ack 2233, win 501, options [nop,nop,TS val 2984782027 ecr 2096185881], length 212
14:14:04.299669 IP 142.93.150.209.22 > 198.96.84.204.42798: Flags [P.], seq 3687004:3687216, ack 2233, win 501, options [nop,nop,TS val 2984782027 ecr 2096185881], length 212
14:14:04.299765 IP 142.93.150.209.22 > 198.96.84.204.42798: Flags [P.], seq 3687216:3687428, ack 2233, win 501, options [nop,nop,TS val 2984782027 ecr 2096185881], length 212
14:14:04.299858 IP 142.93.150.209.22 > 198.96.84.204.42798: Flags [P.], seq 3687428:3687640, ack 2233, win 501, options [nop,nop,TS val 2984782027 ecr 2096185881], length 212
14:14:04.299943 IP 142.93.150.209.22 > 198.96.84.204.42798: Flags [P.], seq 3687640:3687852, ack 2233, win 501, options [nop,nop,TS val 2984782027 ecr 2096185881], length 212
14:14:04.300029 IP 142.93.150.209.22 > 198.96.84.204.42798: Flags [P.], seq 3687852:3688064, ack 2233, win 501, options [nop,nop,TS val 2984782027 ecr 2096185881], length 212
14:14:04.300099 IP 142.93.150.209.22 > 198.96.84.204.42798: Flags [P.], seq 3688064:3688276, ack 2233, win 501, options [nop,nop,TS val 2984782027 ecr 2096185881], length 212
14:14:04.300178 IP 142.93.150.209.22 > 198.96.84.204.42798: Flags [P.], seq 3688276:3688488, ack 2233, win 501, options [nop,nop,TS val 2984782027 ecr 2096185881], length 212
14:14:04.300240 IP 142.93.150.209.22 > 198.96.84.204.42798: Flags [P.], seq 3688488:3688700, ack 2233, win 501, options [nop,nop,TS val 2984782028 ecr 2096185881], length 212
14:14:04.300314 IP 142.93.150.209.22 > 198.96.84.204.42798: Flags [P.], seq 3688700:3688912, ack 2233, win 501, options [nop,nop,TS val 2984782028 ecr 2096185881], length 212
14:14:04.300387 IP 142.93.150.209.22 > 198.96.84.204.42798: Flags [P.], seq 3688912:3689124, ack 2233, win 501, options [nop,nop,TS val 2984782028 ecr 2096185881], length 212
14:14:04.300456 IP 142.93.150.209.22 > 198.96.84.204.42798: Flags [P.], seq 3689124:3689336, ack 2233, win 501, options [nop,nop,TS val 2984782028 ecr 2096185881], length 212
14:14:04.300572 IP 142.93.150.209.22 > 198.96.84.204.42798: Flags [P.], seq 3689336:3689548, ack 2233, win 501, options [nop,nop,TS val 2984782028 ecr 2096185881], length 212
14:14:04.300664 IP 142.93.150.209.22 > 198.96.84.204.42798: Flags [P.], seq 3689548:3689760, ack 2233, win 501, options [nop,nop,TS val 2984782028 ecr 2096185881], length 212
14:14:04.300742 IP 142.93.150.209.22 > 198.96.84.204.42798: Flags [P.], seq 3689760:3689972, ack 2233, win 501, options [nop,nop,TS val 2984782028 ecr 2096185881], length 212
14:14:04.300858 IP 142.93.150.209.22 > 198.96.84.204.42798: Flags [P.], seq 3689972:3690184, ack 2233, win 501, options [nop,nop,TS val 2984782028 ecr 2096185881], length 212
14:14:04.300946 IP 142.93.150.209.22 > 198.96.84.204.42798: Flags [P.], seq 3690184:3690396, ack 2233, win 501, options [nop,nop,TS val 2984782028 ecr 2096185881], length 212
14:14:04.301052 IP 142.93.150.209.22 > 198.96.84.204.42798: Flags [P.], seq 3690396:3690608, ack 2233, win 501, options [nop,nop,TS val 2984782028 ecr 2096185881], length 212
14:14:04.301132 IP 142.93.150.209.22 > 198.96.84.204.42798: Flags [P.], seq 3690608:3690820, ack 2233, win 501, options [nop,nop,TS val 2984782028 ecr 2096185881], length 212
14:14:04.301211 IP 142.93.150.209.22 > 198.96.84.204.42798: Flags [P.], seq 3690820:3691032, ack 2233, win 501, options [nop,nop,TS val 2984782029 ecr 2096185881], length 212
14:14:04.301274 IP 142.93.150.209.22 > 198.96.84.204.42798: Flags [P.], seq 3691032:3691244, ack 2233, win 501, options [nop,nop,TS val 2984782029 ecr 2096185881], length 212
14:14:04.301331 IP 142.93.150.209.22 > 198.96.84.204.42798: Flags [P.], seq 3691244:3691456, ack 2233, win 501, options [nop,nop,TS val 2984782029 ecr 2096185881], length 212
14:14:04.301388 IP 142.93.150.209.22 > 198.96.84.204.42798: Flags [P.], seq 3691456:3691668, ack 2233, win 501, options [nop,nop,TS val 2984782029 ecr 2096185881], length 212
14:14:04.301447 IP 142.93.150.209.22 > 198.96.84.204.42798: Flags [P.], seq 3691668:3691880, ack 2233, win 501, options [nop,nop,TS val 2984782029 ecr 2096185881], length 212
14:14:04.301527 IP 142.93.150.209.22 > 198.96.84.204.42798: Flags [P.], seq 3691880:3692092, ack 2233, win 501, options [nop,nop,TS val 2984782029 ecr 2096185881], length 212
14:14:04.301605 IP 142.93.150.209.22 > 198.96.84.204.42798: Flags [P.], seq 3692092:3692304, ack 2233, win 501, options [nop,nop,TS val 2984782029 ecr 2096185881], length 212
14:14:04.301665 IP 142.93.150.209.22 > 198.96.84.204.42798: Flags [P.], seq 3692304:3692516, ack 2233, win 501, options [nop,nop,TS val 2984782029 ecr 2096185881], length 212
14:14:04.301722 IP 142.93.150.209.22 > 198.96.84.204.42798: Flags [P.], seq 3692516:3692728, ack 2233, win 501, options [nop,nop,TS val 2984782029 ecr 2096185881], length 212
14:14:04.301782 IP 142.93.150.209.22 > 198.96.84.204.42798: Flags [P.], seq 3692728:3692940, ack 2233, win 501, options [nop,nop,TS val 2984782029 ecr 2096185881], length 212
14:14:04.301873 IP 142.93.150.209.22 > 198.96.84.204.42798: Flags [P.], seq 3692940:3693152, ack 2233, win 501, options [nop,nop,TS val 2984782029 ecr 2096185881], length 212
14:14:04.301955 IP 142.93.150.209.22 > 198.96.84.204.42798: Flags [P.], seq 3693152:3693364, ack 2233, win 501, options [nop,nop,TS val 2984782029 ecr 2096185881], length 212
14:14:04.302047 IP 142.93.150.209.22 > 198.96.84.204.42798: Flags [P.], seq 3693364:3693576, ack 2233, win 501, options [nop,nop,TS val 2984782029 ecr 2096185881], length 212
14:14:04.302152 IP 142.93.150.209.22 > 198.96.84.204.42798: Flags [P.], seq 3693576:3693788, ack 2233, win 501, options [nop,nop,TS val 2984782029 ecr 2096185881], length 212
14:14:04.302246 IP 142.93.150.209.22 > 198.96.84.204.42798: Flags [P.], seq 3693788:3694000, ack 2233, win 501, options [nop,nop,TS val 2984782030 ecr 2096185881], length 212
14:14:04.302354 IP 142.93.150.209.22 > 198.96.84.204.42798: Flags [P.], seq 3694000:3694212, ack 2233, win 501, options [nop,nop,TS val 2984782030 ecr 2096185881], length 212
14:14:04.302432 IP 142.93.150.209.22 > 198.96.84.204.42798: Flags [P.], seq 3694212:3694424, ack 2233, win 501, options [nop,nop,TS val 2984782030 ecr 2096185881], length 212
14:14:04.302523 IP 142.93.150.209.22 > 198.96.84.204.42798: Flags [P.], seq 3694424:3694636, ack 2233, win 501, options [nop,nop,TS val 2984782030 ecr 2096185881], length 212
14:14:04.302631 IP 142.93.150.209.22 > 198.96.84.204.42798: Flags [P.], seq 3694636:3694848, ack 2233, win 501, options [nop,nop,TS val 2984782030 ecr 2096185881], length 212
14:14:04.302713 IP 142.93.150.209.22 > 198.96.84.204.42798: Flags [P.], seq 3694848:3695060, ack 2233, win 501, options [nop,nop,TS val 2984782030 ecr 2096185881], length 212
14:14:04.302807 IP 142.93.150.209.22 > 198.96.84.204.42798: Flags [P.], seq 3695060:3695272, ack 2233, win 501, options [nop,nop,TS val 2984782030 ecr 2096185881], length 212
14:14:04.302872 IP 142.93.150.209.22 > 198.96.84.204.42798: Flags [P.], seq 3695272:3695484, ack 2233, win 501, options [nop,nop,TS val 2984782030 ecr 2096185881], length 212
14:14:04.302972 IP 142.93.150.209.22 > 198.96.84.204.42798: Flags [P.], seq 3695484:3695696, ack 2233, win 501, options [nop,nop,TS val 2984782030 ecr 2096185881], length 212
14:14:04.303111 IP 142.93.150.209.22 > 198.96.84.204.42798: Flags [P.], seq 3695696:3695908, ack 2233, win 501, options [nop,nop,TS val 2984782030 ecr 2096185881], length 212
14:14:04.303184 IP 142.93.150.209.22 > 198.96.84.204.42798: Flags [P.], seq 3695908:3696120, ack 2233, win 501, options [nop,nop,TS val 2984782031 ecr 2096185881], length 212
14:14:04.303246 IP 142.93.150.209.22 > 198.96.84.204.42798: Flags [P.], seq 3696120:3696332, ack 2233, win 501, options [nop,nop,TS val 2984782031 ecr 2096185881], length 212
14:14:04.303304 IP 142.93.150.209.22 > 198.96.84.204.42798: Flags [P.], seq 3696332:3696544, ack 2233, win 501, options [nop,nop,TS val 2984782031 ecr 2096185881], length 212
14:14:04.303360 IP 142.93.150.209.22 > 198.96.84.204.42798: Flags [P.], seq 3696544:3696756, ack 2233, win 501, options [nop,nop,TS val 2984782031 ecr 2096185881], length 212
14:14:04.303416 IP 142.93.150.209.22 > 198.96.84.204.42798: Flags [P.], seq 3696756:3696968, ack 2233, win 501, options [nop,nop,TS val 2984782031 ecr 2096185881], length 212
14:14:04.303472 IP 142.93.150.209.22 > 198.96.84.204.42798: Flags [P.], seq 3696968:3697180, ack 2233, win 501, options [nop,nop,TS val 2984782031 ecr 2096185881], length 212
14:14:04.303567 IP 142.93.150.209.22 > 198.96.84.204.42798: Flags [P.], seq 3697180:3697392, ack 2233, win 501, options [nop,nop,TS val 2984782031 ecr 2096185881], length 212
14:14:04.303649 IP 142.93.150.209.22 > 198.96.84.204.42798: Flags [P.], seq 3697392:3697604, ack 2233, win 501, options [nop,nop,TS val 2984782031 ecr 2096185881], length 212
14:14:04.303759 IP 142.93.150.209.22 > 198.96.84.204.42798: Flags [P.], seq 3697604:3697816, ack 2233, win 501, options [nop,nop,TS val 2984782031 ecr 2096185881], length 212
14:14:04.303845 IP 142.93.150.209.22 > 198.96.84.204.42798: Flags [P.], seq 3697816:3698028, ack 2233, win 501, options [nop,nop,TS val 2984782031 ecr 2096185881], length 212
14:14:04.303906 IP 142.93.150.209.22 > 198.96.84.204.42798: Flags [P.], seq 3698028:3698240, ack 2233, win 501, options [nop,nop,TS val 2984782031 ecr 2096185881], length 212
14:14:04.303963 IP 142.93.150.209.22 > 198.96.84.204.42798: Flags [P.], seq 3698240:3698452, ack 2233, win 501, options [nop,nop,TS val 2984782031 ecr 2096185881], length 212
14:14:04.304035 IP 142.93.150.209.22 > 198.96.84.204.42798: Flags [P.], seq 3698452:3698664, ack 2233, win 501, options [nop,nop,TS val 2984782031 ecr 2096185881], length 212
14:14:04.304133 IP 142.93.150.209.22 > 198.96.84.204.42798: Flags [P.], seq 3698664:3698876, ack 2233, win 501, options [nop,nop,TS val 2984782031 ecr 2096185881], length 212
14:14:04.304221 IP 142.93.150.209.22 > 198.96.84.204.42798: Flags [P.], seq 3698876:3699088, ack 2233, win 501, options [nop,nop,TS val 2984782032 ecr 2096185881], length 212
14:14:04.304316 IP 142.93.150.209.22 > 198.96.84.204.42798: Flags [P.], seq 3699088:3699300, ack 2233, win 501, options [nop,nop,TS val 2984782032 ecr 2096185881], length 212
14:14:04.304419 IP 142.93.150.209.22 > 198.96.84.204.42798: Flags [P.], seq 3699300:3699512, ack 2233, win 501, options [nop,nop,TS val 2984782032 ecr 2096185881], length 212
14:14:04.304555 IP 142.93.150.209.22 > 198.96.84.204.42798: Flags [P.], seq 3699512:3699724, ack 2233, win 501, options [nop,nop,TS val 2984782032 ecr 2096185881], length 212
14:14:04.304648 IP 142.93.150.209.22 > 198.96.84.204.42798: Flags [P.], seq 3699724:3699936, ack 2233, win 501, options [nop,nop,TS val 2984782032 ecr 2096185881], length 212
14:14:04.304737 IP 142.93.150.209.22 > 198.96.84.204.42798: Flags [P.], seq 3699936:3700148, ack 2233, win 501, options [nop,nop,TS val 2984782032 ecr 2096185881], length 212
14:14:04.304792 IP 142.93.150.209.22 > 198.96.84.204.42798: Flags [P.], seq 3700148:3700360, ack 2233, win 501, options [nop,nop,TS val 2984782032 ecr 2096185881], length 212
14:14:04.304887 IP 142.93.150.209.22 > 198.96.84.204.42798: Flags [P.], seq 3700360:3700572, ack 2233, win 501, options [nop,nop,TS val 2984782032 ecr 2096185881], length 212
14:14:04.304970 IP 142.93.150.209.22 > 198.96.84.204.42798: Flags [P.], seq 3700572:3700784, ack 2233, win 501, options [nop,nop,TS val 2984782032 ecr 2096185881], length 212
14:14:04.305031 IP 142.93.150.209.22 > 198.96.84.204.42798: Flags [P.], seq 3700784:3700996, ack 2233, win 501, options [nop,nop,TS val 2984782032 ecr 2096185881], length 212
14:14:04.305088 IP 142.93.150.209.22 > 198.96.84.204.42798: Flags [P.], seq 3700996:3701208, ack 2233, win 501, options [nop,nop,TS val 2984782032 ecr 2096185881], length 212
14:14:04.305152 IP 198.96.84.204.42798 > 142.93.150.209.22: Flags [P.], seq 2233:2305, ack 3673896, win 812, options [nop,nop,TS val 2096185890 ecr 2984782021], length 72
14:14:04.305213 IP 142.93.150.209.22 > 198.96.84.204.42798: Flags [P.], seq 3701208:3701420, ack 2305, win 501, options [nop,nop,TS val 2984782033 ecr 2096185890], length 212
14:14:04.305275 IP 142.93.150.209.22 > 198.96.84.204.42798: Flags [P.], seq 3701420:3701632, ack 2305, win 501, options [nop,nop,TS val 2984782033 ecr 2096185890], length 212
^C
18015 packets captured
18820 packets received by filter
805 packets dropped by kernel

